{
  "schema_version": "1.0.0",
  "register_status": "recommendation",
  "generated_at": "2026-08-07T00:00:00+02:00",
  "records": [
    {
      "access_id": "access-example-control-plane",
      "organisation_id": "example-org",
      "environment": "production_shared",
      "capability": "provider control-plane administration",
      "system_provider": "example hosting provider",
      "account_class": "human_named",
      "human_or_machine": "human",
      "owner": "organisation owner",
      "authority_role": "authorised infrastructure owner",
      "privilege_scope": "provider-wide administration; intentionally broad and human-only",
      "execution_boundary": "human enters credentials directly and performs only the authorised capability",
      "authentication_method_class": "password_mfa",
      "secret_location_class": "human_bitwarden",
      "production_impact": "critical",
      "provider_constraint": "example provider does not offer a narrower control-panel user role",
      "recovery_route_status": "human_verification_required",
      "last_reviewed": null,
      "expires_at": null,
      "rotation_trigger": ["suspected_compromise", "role_or_owner_change", "provider_requirement", "risk_review"],
      "revocation_status": "not_required",
      "status": "recommendation",
      "evidence_reference": ["EXAMPLE-ONLY-NOT-PRODUCTION-EVIDENCE"],
      "notes": "Fictitious record. Replace only after human verification; never add a username, password, recovery code or vault item name."
    },
    {
      "access_id": "access-example-temporary-deploy",
      "organisation_id": "example-org",
      "environment": "production",
      "capability": "task-scoped release file transfer",
      "system_provider": "example hosting provider",
      "account_class": "temporary_task",
      "human_or_machine": "machine",
      "owner": "authorised release owner",
      "authority_role": "human release authoriser",
      "privilege_scope": "hosting-package filesystem because a narrower provider scope is not proven",
      "execution_boundary": "one approved release and time window; no control-panel, DNS, mail or database action",
      "authentication_method_class": "ssh_public_key",
      "secret_location_class": "temporary_restricted_local",
      "production_impact": "high",
      "provider_constraint": "public-key authentication does not by itself prove path-restricted access",
      "recovery_route_status": "not_applicable",
      "last_reviewed": null,
      "expires_at": "2026-08-07T12:00:00+02:00",
      "rotation_trigger": ["task_complete", "suspected_compromise", "repository_or_log_exposure"],
      "revocation_status": "planned",
      "status": "recommendation",
      "evidence_reference": ["EXAMPLE-RELEASE-EVIDENCE-ID"],
      "notes": "Fictitious proposed record. Evidence may retain a non-secret fingerprint, never public/private key material."
    },
    {
      "access_id": "access-example-workspace-admin",
      "organisation_id": "example-customer",
      "environment": "future",
      "capability": "customer workspace administration",
      "system_provider": "Atlas Workspace",
      "account_class": "human_named",
      "human_or_machine": "human",
      "owner": "customer organisation owner",
      "authority_role": "customer workspace administrator",
      "privilege_scope": "application data and settings for this organisation only",
      "execution_boundary": "no infrastructure, provider, deployment or cross-organisation rights",
      "authentication_method_class": "unknown",
      "secret_location_class": "unknown",
      "production_impact": "medium",
      "provider_constraint": "application permissions are independent of infrastructure access",
      "recovery_route_status": "unknown",
      "last_reviewed": null,
      "expires_at": null,
      "rotation_trigger": ["role_or_owner_change", "risk_review"],
      "revocation_status": "planned",
      "status": "recommendation",
      "evidence_reference": ["EXAMPLE-ONLY-FUTURE-DESIGN"],
      "notes": "Fictitious boundary example; grants no TransIP, DNS, mail, database, backup or Atlas infrastructure access."
    }
  ]
}
